"Token Value","Attribute Name","Attribute Setting",Description,Spec,Request
0176,"Absolute Security ROM",Enabled,"This feature will allow users to permanently disable or permanently enable Absolute Software’s Computrace security software BIOS ROM. Once either token is written, the state is permanently maintained (i.e. this is a write-once field). This token is for Factory use only. Application and Management software must ignore or not use this token. Write-once-permanent is different from write-once. Write-once is reset on a power cycle and/or chipset reset. Write-once permanent cannot be reset/change once it is set.",2.001,
0177,"Serial Communication",Off,"COM1 and COM2 are both disabled and not available for use by the Operating System or applications. BIOS Console Redirection is disabled.",2.001,
0178,"Serial Communication","On without Console Redirection","COM1 and COM2 are enabled and available for use by the Operating System or applications. Console Redirection is disabled.",2.001,
0179,"Serial Communication","On with Console Redirection via COM1","COM1 and COM2 are enabled and available for use by the Operating System or applications. BIOS Console Redirection is via COM1.",2.001,
017A,"Serial Communication","On with Console Redirection via COM2","COM1 and COM2 are enabled and available for use by the Operating System or applications. BIOS Console Redirection is via COM2.",2.001,
017B,"Cellular Radio",Disable,"Disable cellular radio (i.e. the WWAN module).",2.001,
017C,"Cellular Radio",Enable,"Enable cellular radio (i.e. the WWAN module).",2.001,
017D,"WiFi Locator",Disable,"Disable the WiFi locator feature.",2.001,
017E,"WiFi Locator",Enable,"Enable the WiFi locator feature. When enabled, the locator feature can be activated during S3 to indicate the presence and intensity of wireless network(s), without fully waking the system.",2.001,
017F,"Wireless LAN",Disable,"Disable wireless LAN module.",2.001,
0180,"Wireless LAN",Enable,"Enable wireless LAN module.",2.001,
0181,"Wireless Switch Bluetooth Control",Disable,"For systems that have a physical “Wireless On/Off Switch”, switch will have no effect on the state of the Bluetooth radio.",2.001,
0182,"Wireless Switch Bluetooth Control",Enable,"For systems that have a physical “Wireless On/Off Switch”, switch will turn the Bluetooth radio on and off.",2.001,
0183,"Wireless Switch Cellular Control",Disable,"For systems that have a physical “Wireless On/Off Switch”, switch will have no effect on the state of the cellular radio.",2.001,
0184,"Wireless Switch Cellular Control",Enable,"For systems that have a physical “Wireless On/Off Switch”, switch will turn the cellular (i.e. WWAN) radio on and off.",2.001,
0185,"Wireless Switch Wireless LAN Control",Disable,"For systems that have a physical “Wireless On/Off Switch”, switch will have no effect on the state of the wireless LAN radio.",2.001,
0186,"Wireless Switch Wireless LAN Control",Enable,"For systems that have a physical “Wireless On/Off Switch”, switch will turn the wireless LAN radio on and off.",2.001,
0187,ALS,Off,"The panel brightness is controlled by the Fn+Up-arrow and Fn+Down-arrow keys and by the brightness fields in BIOS setup. Meant to be used by factory configuration utilities such as SMMFGCFG, although they can be manipulated by OS-level applications as well.",2.001,
0188,ALS,Enabled,"Ambient Light Sensor (ALS) in certain notebook computers, controls the brightness of the notebook’s LCD panel according to the amount of light in the surrounding environment.",2.001,
0189,"External USB Ports",Disabled,"Will enable/disable all external USB ports. If the system supports a dock, all USB to the dock is also enabled/disabled, so that USB in the dock can be totally disabled—all ports on the dock as well as any USB devices inside the dock.",2.001,
018A,"External USB Ports",Enabled,"Will enable/disable all external USB ports. If the system supports a dock, all USB to the dock is also enabled/disabled, so that USB in the dock can be totally disabled—all ports on the dock as well as any USB devices inside the dock.",2.001,
018B,"Media Card and 1394",Disabled,"Will disable both the Media Card and 1394 devices.",2.001,
018C,"Media Card and 1394",Enabled,"Will enable both the Media Card and 1394 devices.",2.001,
018D,"PC Card and 1394",Disabled,"Will disable both the PC Card and 1394 devices.",2.001,
018E,"PC Card and 1394",Enabled,"Will enable both the PC Card and 1394 devices.",2.001,
018F,"PC Card",Disabled,"Will disable PC Card device.",2.001,
0190,"PC Card",Enabled,"Will enable PC Card device.",2.001,
0191,"Wi-Fi Catcher Changes",Denied,"Will deny changes to the Wi-Fi Catcher setting (in setup and via the token mechanism) when an administrator password is set. If the administrator password is not set, this token’s setting will have no effect.",2.001,
0192,"Wi-Fi Catcher Changes",Permitted,"Will permit changes to the Wi-Fi Catcher setting (in setup and via the token mechanism) when an administrator password is set. If the administrator password is not set, this token’s setting will have no effect.",2.001,
0193,"Wireless Switch Changes",Denied,"Will deny changes to the Wireless Switch setting (in setup and via the token mechanism) when an administrator password is set. If the administrator password is not set, this token’s setting will have no effect.",2.001,
0194,"Wireless Switch Changes",Permitted,"Will permit changes to the Wireless Switch setting (in setup and via the token mechanism) when an administrator password is set. If the administrator password is not set, this token’s setting will have no effect.",2.001,
0195,"FBD Memory Test Request","Test Not Requested","The OS application can only request one memory configuration at one time. The requested memory configuration will be valid only on the following system reboot. The OS application can request another memory configuration once finished the test for the first memory configuration. The second requested memory configuration will be valid only on the following reboot. There is no restriction to the order of the memory configurations. The tokens will not exist if the system does not support FBD Memory IBIST and MBIST. The OS application can abort the test by setting the FBD Test Not Request token.",2.001,
0196,"FBD Memory Test Request","Memory Configuration 0","The OS application can only request one memory configuration at one time. The requested memory configuration will be valid only on the following system reboot. The OS application can request another memory configuration once finished the test for the first memory configuration. The second requested memory configuration will be valid only on the following reboot. There is no restriction to the order of the memory configurations. The tokens will not exist if the system does not support FBD Memory IBIST and MBIST. The OS application can abort the test by setting the FBD Test Not Request token.",2.001,
0197,"FBD Memory Test Request","Memory Configuration 1","The OS application can only request one memory configuration at one time. The requested memory configuration will be valid only on the following system reboot. The OS application can request another memory configuration once finished the test for the first memory configuration. The second requested memory configuration will be valid only on the following reboot. There is no restriction to the order of the memory configurations. The tokens will not exist if the system does not support FBD Memory IBIST and MBIST. The OS application can abort the test by setting the FBD Test Not Request token.",2.001,
0198,"Wake on LAN","LAN or WLAN","On systems that have onboard LAN and wireless LAN hardware, we need a token to enable wake on either wired or wireless LAN. It is not possible to set up the system to only wake on wireless.",2.001,
0199,"SATA DIPM",Disabled,"This feature will allow users to disable the feature that allows SATA HDDs to initiate link power management transitions.",2.001,
019A,"SATA DIPM",Enabled,"This feature will allow users to enable the feature that allows SATA HDDs to initiate link power management transitions.",2.001,
019B,"Password Bypass",Off,"This feature will allow users to skip the entry of the System password, internal Hard Disk password, fingerprint scan or smartcard on either/both Reboot (warm boot) or S3 resume (resume from standby).",2.001,
019C,"Password Bypass","Reboot Bypass","This feature will allow users to skip the entry of the System password, internal Hard Disk password, fingerprint scan or smartcard on either/both Reboot (warm boot) or S3 resume (resume from standby).",2.001,
019D,"Password Bypass","Resume Bypass","This feature will allow users to skip the entry of the System password, internal Hard Disk password, fingerprint scan or smartcard on either/both Reboot (warm boot) or S3 resume (resume from standby).",2.001,
019E,"Password Bypass","Reboot and Resume Bypass","This feature will allow users to skip the entry of the System password, internal Hard Disk password, fingerprint scan or smartcard on either/both Reboot (warm boot) or S3 resume (resume from standby).",2.001,
019F,"Integrated USB Hub",Compatible,"Compatible setting can be used to force the integrated USB 2.0 hub to operate as a USB 1.1 hub, which can dramatically improve battery life under some operating systems.",2.001,
01A0,"Integrated USB Hub","High Speed","The High Speed setting allows the hub to function as a 2.0 hub.",2.001,
01A1,"USB Port 00",Disabled,"Disable USB Port 0",2.001,
01A2,"USB Port 00",Enabled,"Enable USB Port 0",2.001,
01A3,"USB Port 01",Disabled,"Disable USB Port 1",2.001,
01A4,"USB Port 01",Enabled,"Enable USB Port 1",2.001,
01A5,"USB Port 02",Disabled,"Disable USB Port 2",2.001,
01A6,"USB Port 02",Enabled,"Enable USB Port 2",2.001,
01A7,"USB Port 03",Disabled,"Disable USB Port 3",2.001,
01A8,"USB Port 03",Enabled,"Enable USB Port 3",2.001,
01A9,"USB Port 04",Disabled,"Disable USB Port 4",2.001,
01AA,"USB Port 04",Enabled,"Enable USB Port 4",2.001,
01AB,"USB Port 05",Disabled,"Disable USB Port 5",2.001,
01AC,"USB Port 05",Enabled,"Enable USB Port 5",2.001,
01AD,"USB Port 06",Disabled,"Disable USB Port 6",2.001,
01AE,"USB Port 06",Enabled,"Enable USB Port 6",2.001,
01AF,"USB Port 07",Disabled,"Disable USB Port 7",2.001,
01B0,"USB Port 07",Enabled,"Enable USB Port 7",2.001,
01B1,"USB Port 08",Disabled,"Disable USB Port 8",2.001,
01B2,"USB Port 08",Enabled,"Enable USB Port 8",2.001,
01B3,"USB Port 09",Disabled,"Disable USB Port 9",2.001,
01B4,"USB Port 09",Enabled,"Enable USB Port 9",2.001,
01B5,"USB Port 10",Disabled,"Disable USB Port 10",2.001,
01B6,"USB Port 10",Enabled,"Enable USB Port 10",2.001,
01B7,"USB Port 11",Disabled,"Disable USB Port 11",2.001,
01B8,"USB Port 11",Enabled,"Enable USB Port 11",2.001,
01B9,"USB Port 12",Disabled,"Disable USB Port 12",2.001,
01BA,"USB Port 12",Enabled,"Enable USB Port 12",2.001,
01BB,"USB Port 13",Disabled,"Disable USB Port 13",2.001,
01BC,"USB Port 13",Enabled,"Enable USB Port 13",2.001,
01BD,"USB Port 14",Disabled,"Disable USB Port 14",2.001,
01BE,"USB Port 14",Enabled,"Enable USB Port 14",2.001,
01BF,"USB Port 15",Disabled,"Disable USB Port 15",2.001,
01C0,"USB Port 15",Enabled,"Enable USB Port 15",2.001,
01C1,ASF,Off,"No ASF support",2.001,
01C2,ASF,On,"Full ASF support",2.001,
01C3,ASF,AlertOnly,"Enable only error messages",2.001,
01C4,"Node Interleave",Disabled,"For BIOS Setup to allow user enable or disable the node interleave option. This is for NUMA systems that allow memory interleaving across all processor nodes.",2.002,
01C5,"Node Interleave",Enabled,"For BIOS Setup to allow user enable or disable the node interleave option. This is for NUMA systems that allow memory interleaving across all processor nodes.",2.002,
01C6,"Video Memory Size",Off,"These tokens are used to configure the amount of memory allocated to the onboard Nvidia video chipset.",2.002,
01C7,"Video Memory Size",Auto,"These tokens are used to configure the amount of memory allocated to the onboard Nvidia video chipset.",2.002,
01C8,"Video Memory Size",16MB,"These tokens are used to configure the amount of memory allocated to the onboard Nvidia video chipset.",2.002,
01C9,"Video Memory Size",32MB,"These tokens are used to configure the amount of memory allocated to the onboard Nvidia video chipset.",2.002,
01CA,"Video Memory Size",64MB,"These tokens are used to configure the amount of memory allocated to the onboard Nvidia video chipset.",2.002,
01CB,"Video Memory Size",128MB,"These tokens are used to configure the amount of memory allocated to the onboard Nvidia video chipset.",2.002,
01CC,"Embedded SAS Controller",Disabled,"Disables the embedded SAS controller.",2.002,
01CD,"Embedded SAS Controller",Enabled,"Enables the embedded SAS controller.",2.002,
01CE,"Sound Device",Auto,"Use the add-in Audio controller if detected and disable the Integrated Audio controller",2.002,
01CF,"I/OAT DMA Engine",Enabled,"Enables/Disables the I/O Acceleration Technology (I/OAT) DMA Engine option. This feature should be enabled only if the hardware and software support I/OAT.",2.002,
01D0,"I/OAT DMA Engine",Disabled,"Enables/Disables the I/O Acceleration Technology (I/OAT) DMA Engine option. This feature should be enabled only if the hardware and software support I/OAT.",2.002,
01D1,"Built-in Floppy",USB,"Built-in floppy controller is disabled but booting to a USB floppy is still allowed.",2.002,
01D2,"Rear Quad USB",Off,"Controls for each stack of USB ports on the rear of desktop machines.",2.002,
01D3,"Rear Quad USB",On,"Controls for each stack of USB ports on the rear of desktop machines.",2.002,
01D4,"Rear Dual USB",Off,"Controls for each stack of USB ports on the rear of desktop machines.",2.002,
01D5,"Rear Dual USB",On,"Controls for each stack of USB ports on the rear of desktop machines.",2.002,
01D6,"Low Power Mode",Disabled,"Setting the option to “Disabled” will allow memory to run at full speed.",2.002,
01D7,"Low Power Mode",Enabled,"Setting the option to “Enabled” will down-clock the memory to conserve power.",2.002,
01D8,"Module Bay Device",Disabled,"These tokens are used to enable/disable Dell notebook module bay device (except battery).",2.002,
01D9,"Module Bay Device",Enabled,"These tokens are used to enable/disable Dell notebook module bay device (except battery).",2.002,
01DA,"Embedded NIC1","Enabled with ISCSI Boot","NIC 1 enabled with ISCSI Boot",2.002,
01DB,"Embedded NIC2","Enabled with ISCSI Boot","NIC 2 enabled with ISCSI Boot",2.002,
01DC,"OCCUR (OpenCable Unidirectional Receiver)",Disabled,"A factory tools employs this token to permanently disable the OCUR (OpenCable Unidirectional Receiver) feature. This feature may become enabled/disabled just once; further attempts to enable/disable OCUR will fail.",2.002,
01DD,"OCCUR (OpenCable Unidirectional Receiver)",Enabled,"A factory tools employs this token to permanently enable the OCUR (OpenCable Unidirectional Receiver) feature. This feature may become enabled/disabled just once; further attempts to enable/disable OCUR will fail.",2.002,
01DE,Microphone,Disabled,"These tokens are used to enable/disable Dell notebook internal/external microphone.",2.002,
01DF,Microphone,Enabled,"These tokens are used to enable/disable Dell notebook internal/external microphone.",2.002,
01E0,"Integrated NIC","Enabled with ImageServer boot","These tokens control how the integrated NIC is to be configured and which option ROM to load (if any). This token is for the “Enabled with ImageServer boot” as all of the other selections already have assigned token values. Enabled with ImageServer boot will be used in the deployment of Dell’s SmartClient products.",2.002,
01E1,"Keyboard Illumination",Off,"These tokens are used to change the Setup option for the keyboard illumination mode. The options are Auto (illumination set based on ambient light level), Off (illumination always off), and On (illumination always on).",2.002,
01E2,"Keyboard Illumination",On,"These tokens are used to change the Setup option for the keyboard illumination mode. The options are Auto (illumination set based on ambient light level), Off (illumination always off), and On (illumination always on).",2.002,
01E3,"Keyboard Illumination",Auto,"These tokens are used to change the Setup option for the keyboard illumination mode. The options are Auto (illumination set based on ambient light level), Off (illumination always off), and On (illumination always on).",2.002,
01E4,"UART Power Down",Off,"Allow OS to power down UART",2.002,
01E5,"UART Power Down",On,"Prohibit OS from powering down UART",2.002,
01E6,"FSB Optimizations",Off,"Turn on/off optimizations for high-bandwidth FSB applications",2.002,
01E7,"FSB Optimizations",On,"Turn on/off optimizations for high-bandwidth FSB applications",2.002,
01E8,"MEBx Hotkey",Off,"Controls the display of the MEBx hotkey (Ctrl-P) at POST on the sign-on screen.",2.002,
01E9,"MEBx Hotkey",On,"Controls the display of the MEBx hotkey (Ctrl-P) at POST on the sign-on screen.",2.002,
01EA,"Core-Based Turbo Mode",Off,"Allows one processor core to increase it’s frequency by one bin whenever the other core has gone into an idle state (C3). Only available on certain processors.",2.002,
01EB,"Core-Based Turbo Mode",Enabled,"Allows one processor core to increase it’s frequency by one bin whenever the other core has gone into an idle state (C3). Only available on certain processors.",2.002,

01EC,"Flash Cache Module",Disabled,"This is a flash-based disk cache technology that works with Vista (and possibly future OS’s) to provide ReadyBoost and ReadyCache functionality.",2.002,
01ED,"Flash Cache Module",Enabled,"This is a flash-based disk cache technology that works with Vista (and possibly future OS’s) to provide ReadyBoost and ReadyCache functionality.",2.002,
01EE,"Resume On Pen",Disabled,"Control whether a tablet PC will resume from the S3 state when the pen is removed from its retaining well.",2.002,

01EF,"Resume On Pen",Enabled,"Control whether a tablet PC will resume from the S3 state when the pen is removed from its retaining well.",2.002,
01F0,NIC3,Disabled,Disabled,2.002,
01F1,NIC3,Enabled,Enabled,2.002,
01F2,NIC3,"Enabled with PXE","Enabled with PXE Boot",2.002,
01F3,NIC3,"Enabled with iSCSI Boot","Enabled with iSCSI Boot",2.002,
01F4,NIC4,Disabled,Disabled,2.002,
01F5,NIC4,Enabled,Enabled,2.002,
01F6,NIC4,"Enabled with PXE","Enabled with PXE Boot",2.002,
01F7,NIC4,"Enabled with iSCSI Boot","Enabled with iSCSI Boot",2.002,
01F8,"Missing Pen Indication",Disabled,"Control whether a Tablet PC will indicate pen removed out of its retaining well by blinking pen LED.",2.002,
01F9,"Missing Pen Indication",Enabled,"Control whether a Tablet PC will indicate pen removed out of its retaining well by blinking pen LED.",2.002,
01FA,"Tablet Buttons Functionality",Disabled,"Control whether the hardware buttons located on the LCD will be functional or not.",2.002,
01FB,"Tablet Buttons Functionality",Enabled,"Control whether the hardware buttons located on the LCD will be functional or not.",2.002,
01FC,"OS Watchdog Timer",Disabled,"Controls whether an OS can configure a chipset-based timer to reset or shutdown the system",2.002,
01FD,"OS Watchdog Timer",Enabled,"Controls whether an OS can configure a chipset-based timer to reset or shutdown the system",2.002,

01FE,"SATA Controller",QDMA,"Enables the SATA controller. Sets the device class code as RAID. This token applies to the first on-board SATA controller.",2.002,

01FF,"SATA Controller Shadow Copy",QDMA,"The SATA controller is set to QDMA mode on the previous system boot (from a BIOS perspective) or on the current system boot (from an application perspective). Notes: The notes for token “SATA Controller Shadow Copy - Combined“ also apply to this token. This token applies to the first on-board SATA controller.",2.002,

0200,"ATG System",Clear,"These tokens are used to set/clear the CMOS bit to indicate the system uses an All-Terrain-Gear (ATG) or non-ATG base. The ATG base has WWAN/GPS noise shielding.",2.002,

0201,"ATG System",Set,"These tokens are used to set/clear the CMOS bit to indicate the system uses an All-Terrain-Gear (ATG) or non-ATG base. The ATG base has WWAN/GPS noise shielding.",2.002,

0202,"Trusted Execution",Off,"Intel Trusted Execution Technology (TxT) – new processor execution mode and BIOS hooks to enable a protected execution environment and main memory protection.",2.002,

0203,"Trusted Execution",On,"Intel Trusted Execution Technology (TxT) – new processor execution mode and BIOS hooks to enable a protected execution environment and main memory protection.",2.002,

0204,"VT for Direct I/O",Off,"Intel Virtualization Technology for Direct I/O (VT-d) – new chipset feature that enhances I/O support (DMA) when running a Virtual Machine Monitor.",2.002,

0205,"VT for Direct I/O",On,"Intel Virtualization Technology for Direct I/O (VT-d) – new chipset feature that enhances I/O support (DMA) when running a Virtual Machine Monitor.",2.002,

0206,"Virtual Appliance",Off,"Intel Virtual Appliance 3.0 – hardened Virtual Appliance support for a system to take advantage of TPM and TxT using an LVMM and a User OS and Service OS.",2.002,

0207,"Virtual Appliance",On,"Intel Virtual Appliance 3.0 – hardened Virtual Appliance support for a system to take advantage of TPM and TxT using an LVMM and a User OS and Service OS.",2.002,

0208,"VA Config Lock",Unlocked,"Intel Virtual Appliance 3.0 Configuration Lock – Locks down the VA 3.0 ACPI configuration interface.",2.002,

0209,"VA Config Lock",Locked,"Intel Virtual Appliance 3.0 Configuration Lock – Locks down the VA 3.0 ACPI configuration interface.",2.002,

020A,"Optional HDD fan",Installed,"Optional HDD fan is installed. Enable monitroing and present fan data to Diags.",2.003,112
020B,"Optional HDD fan","Not Installed","Optional HDD fan is not installed. Disable monitoring and don't present fan date to Diags.",2.003,112

020C,"Optical Drive Controller",Enabled,"This option allows the user to enable/disable a system’s optical drive controller. Currently, we use tokens 0x0003 and 0x0004 for “IDE CD-ROM Controller” which specify IDE controller. We have systems now that could have an IDE or a SATA optical drive so we are creating a new token. When these tokens are used, the system BIOS will disable either the IDE or SATA controller depending on which type of drive is present.",2.002,
020D,"Optical Drive Controller",Disabled,"This option allows the user to enable/disable a system’s optical drive controller. Currently, we use tokens 0x0003 and 0x0004 for “IDE CD-ROM Controller” which specify IDE controller. We have systems now that could have an IDE or a SATA optical drive so we are creating a new token. When these tokens are used, the system BIOS will disable either the IDE or SATA controller depending on which type of drive is present.",2.002,

020E,"Video Memory Size",256MB,"These tokens are used to configure the amount of memory allocated to the onboard Nvidia video chipset.",2.002,
01C7,"Video Memory Size",Auto,"These tokens are used to configure the amount of memory allocated to the onboard Nvidia video chipset.",2.002,
020F,"Video Memory Size",512MB,"These tokens are used to configure the amount of memory allocated to the onboard Nvidia video chipset.",2.002,

0210,"Video Memory Size",1GB,"These tokens are used to configure the amount of memory allocated to the onboard Nvidia video chipset.",2.002,

0211,"Internal USB",Disabled,"This field enables/disables the internal USB port. Note, this is intended for the nonhypervisor port.",2.002,
0212,"Internal USB",Enabled,"This field enables/disables the internal USB port. Note, this is intended for the nonhypervisor port.",2.002,
0213,"Embedded Hypervisor",Disabled,"This field enables/disables the embedded hypervisor port.",2.002,
0214,"Embedded Hypervisor",Enabled,"This field enables/disables the embedded hypervisor port.",2.002,
0215,"Internal Floppy",Enabled,"This will work in conjunction with tokens 19h, 1Bh, and 1D1h to map to all four settings for the diskette drive setting in desktop BIOS.",2.002,

0216,"Wake on WLAN",Enabled,"Enable Wake on WLAN only.",2.002,
0217,"VA Physical Presence Confirmation",Off,"Turn VA Physical Presence Confirmation off. This will allow a VA install application to make VA configuration changes without rebooting.",2.003,108
0218,"VA Physical Presence Confirmation",On,"Turn VA Physical Presence Confirmation on. This forces the VA install application to reboot the system and for the BIOS to confirm physical presence before making VA configuration changes.",2.003,108
0219,"AMD Memory Optimizer Technology",Enable,"When set to Enabled, the two DRAM controllers operate independently in 64-bit mode and provide optimized performance without Advanced ECC.",2.003,115
021A,"AMD Memory Optimizer Technology",Disable,"When set to Disabled (default), the two DRAM controllers are combined in 128-bit mode and provide optimized reliability with Advanced ECC.",2.003,115
021B,"Cool and Quiet",Enabled,"This setting enables the AMD Cool and Quiet processor feature",2.003,124
021C,"Cool and Quiet",Disabled,"This setting disables the AMD Cool and Quiet processor feature",2.003,124
021D,"High-Bandwidth Memory Mode",Enabled,"Enabling this will defer some CPU to memory cycles, and may write them out-of-order, to enhance performance tuning. Some system configurations may use this to optimize for some applications high-memory bandwidth usage models",2.003,126
021E,"High-Bandwidth Memory Mode",Disabled,"Disabling would not optimize the performance as memory cycles are not deferred.",2.003,126
021F,"Power/Performance Management","Static Max Performance","This will set the Max. Performance mode in the system.",,146
0220,"Power/Performance Management","b. Static Min Performance","Lowest system performance mode.",,147
