"Token Value","Attribute Name","Attribute Setting",Description,Spec,Request
00CA,"Redundant Memory",Off,"Redundant memory support is off. Any change takes effect on the next system boot. Note: The Attribute Name is generalized from “Redundant Memory Support” to “Redundant Memory” since DSIS v1.6.",,

00CB,"Redundant Memory",Spare,"Redundant memory support is set for the spare feature. Any change takes effect on the next system boot. This is a general Attribute Setting for systems that support only a single mode of spare memory; for example either Spare Bank or Spare Rank mode. Note: The Attribute Name is generalized from “Redundant Memory Support” to “Redundant Memory” since DSIS v1.6. The Attribute Setting is also generalized from “Spare Bank” to ‘Spare’ since DSIS v1.6.",,

00CC,"Redundant Memory",Mirror,"Redundant memory support is set for the memory-mirroring feature. Any change takes effect on the next system boot. Note: The Attribute Name is generalized from “Redundant Memory Support” to “Redundant Memory” since DSIS v1.6. The Attribute Setting is also generalized from “Mirroring Enabled” to ‘Mirror’ since DSIS v1.6.",,

00CD,"Embedded RAID Channel A Shadow Copy",RAID,"The embedded RAID controller's Channel A was set to operate in RAID mode on the previous system boot (from a BIOS perspective) or on the current system boot (from an application perspective). Notes: 1.This setting has no meaning unless the embedded RAID controller is set to operate in RAID mode (see token B4h). 2.The BIOS compares this value to the primary copy's settings (see tokens B6h through B9h) and prompts the user if a change is detected. 3.After handling the compare action, the BIOS copies the primary copy token value to the shadow copy token value on each boot. 4.Manufacturing diagnostics use the Shadow Copy tokens to synchronize the channel settings to remove the unwanted BIOS prompts.",,

00CE,"Embedded RAID Channel A Shadow Copy",SCSI,"The embedded RAID controller's Channel A was set to operate in SCSI mode on the previous system boot. The notes for token CDh also apply to this token.",,
00CF,"Embedded RAID Channel B Shadow Copy",RAID,"The embedded RAID controller's Channel B was set to operate in RAID mode on the previous system boot. The notes for token CDh also apply to this token.",,
00D0,"Embedded RAID Channel B Shadow Copy",SCSI,"The embedded RAID controller's Channel B was set to operate in SCSI mode on the previous system boot. The notes for token CDh also apply to this token.",,
00D1,"CPU HyperThreading",Enabled,"Enables Hyper Threading on all “Jackson Technology” CPU’s.",,
00D2,"CPU HyperThreading",Disabled,"Disables Hyper Threading on all “Jackson Technology” CPU’s.",,
00D3,"Cpu1 Rated Speed",Value,"Rated speed of CPU1 => 2 byte (LSB then MSB)",,
00D4,"Cpu2 Rated Speed",Value,"Rated speed of CPU2 => 2 byte (LSB then MSB)",,
00D5,"Cpu3 Rated Speed",Value,"Rated speed of CPU3 => 2 byte (LSB then MSB)",,
00D6,"Cpu4 Rated Speed",Value,"Rated speed of CPU4 => 2 byte (LSB then MSB)",,
00D7,"Console Redirection",COM2,"Serial Console redirection On –, output to COM2. See also tokens BFh and C0h.",,
00D8,"Default CMOS",Enabled,"Request a default of CMOS values on the next boot. The BIOS returns this attribute to the Disabled setting after handling.",,
00D9,"Default CMOS",Disabled,"Don’t request a default of CMOS on the next boot",,
00DA,"Redundant Memory Capabilities",Capable,"(Read-only) The current memory configuration is valid for redundant memory support. See also tokens CAh through CCh, and 134h.",,
00DB,"Redundant Memory Capabilities","Not Capable","(Read-only) The current memory configuration is not valid (incapable) for redundant memory support.",,
00DC,"Redundant Memory Capabilities","Redundancy Available","(Read-only) Memory subsystem redundancy is still available, redundant memory is not currently in use. Note: This token is present in the SMBIOS token pool only if one of the redundant memory support features (tokens CBh, CCh, and 134h) is enabled when the system boots.",,
00DD,"Redundant Memory Capabilities","Redundancy Lost","(Read-only) Memory subsystem redundancy has been lost, redundant memory is currently in use. Note: This token is present in the SMBIOS token pool only if one of the redundant memory support features (tokens CBh, CCh, and 134h) is enabled when the system boots.",,
00DE,"Single Byte ECC Logging",Disabled,"BIOS has disabled reporting/logging or Single Byte ECC errors in the chipset.",,
00DF,Unassigned,,,,
00E0,E-support,Selected,"This token indicates that an E-support request has been made. This can be SET to force an E-support request.",,
00E1,E-support,"Not Selected","This token indicates that an E-support request has not been made. This is also SET to turn off the E0h token.",,
00E2,"F2 Post Display",Enabled,"Enables F2=Setup on POST boot screen.",,
00E3,"F2 Post Display",Disabled,"Disables F2=Setup on POST boot screen.",,
00E4,"F12 Post Display",Enabled,"Enables F12=Boot Menu on POST boot screen.",,
00E5,"F12 Post Display",Disabled,"Disables F12=Boot Menu on POST Boot screen.",,
00E6,"Boot Speed",Default,"Sets CPU speed to Default",,
00E7,"Boot Speed",Compatible,"Sets CPU speed to Compatible (lots slower). This is implementation dependent. There is no ‘set’ speed for Compatible, only that it is significantly slower than Default. Some platforms implement this by turning off Cache, some by STPCLK throttling.",,
00E8,"MiniPCI Device",Enabled,"Enables internal MiniPCI device.",,
00E9,"MiniPCI Device",Disabled,"Disables internal MiniPCI device.",,
00EA,"POST Boot Testing",Minimal,"Sets POST to perform minimal hardware testing.",,
00EB,"POST Boot Testing",Thorough,"Sets POST to perform complete HW and configuration testing.",,
00EC,"POST Boot Testing",Automatic,"Allows the BIOS to decide what level of POST test is used.",,
00ED,SpeedStep,Disabled,"Disables SpeedStep dynamic clock changes.",,
00EE,SpeedStep,"Maximum Performance","The system is placed in the maximum performance state available.",,
00EF,SpeedStep,"Maximum Battery","The system is placed in the minimum performance state available",,
00F0,SpeedStep,Automatic,"Allows the BIOS to set either Max Performance, or Max Battery, based on AC presence.",,
00F1,"Pointing Device","External Serial Only","Use an external serial mouse and disable integrated touch pad.",,
00F2,"Pointing Device","External PS2 Only","Disable the integrated touchpad when an external PS/2 mouse is present.",,
00F3,"Pointing Device","Switch to Touchpad","Switch to touchpad, when both the touchpad and an external PS/2 mouse is present.",,
00F4,"Pointing Device","Switch to external PS2","Switch to external PS2, when both the touchpad and an external PS/2 mouse is present.",,
00F5,"Low Power Mode",Enabled,"The system will go into lowest-Power Off mode in S4 and S5, turning off as much of the power-consuming circuitry as required, to attempt to meet 1W power limit. This may disable things like PME, USB power, etc.",,
00F6,"Low Power Mode",Disabled,"The system will be in a normal power-use mode when in S4 or S5.",,
00F7,"Cpu5 Rated Speed",Value,"Rated speed of CPU5 => 2 byte (LSB then MSB)",,
00F8,"Cpu6 Rated Speed",Value,"Rated speed of CPU6 => 2 byte (LSB then MSB)",,
00F9,"Cpu7 Rated Speed",Value,"Rated speed of CPU7 => 2 byte (LSB then MSB)",,
00FA,"Cpu8 Rated Speed",Value,"Rated speed of CPU8 => 2 byte (LSB then MSB)",,
00FB,ASF,Enable,"Enables ASF Alerts through on-board NIC.",,
00FC,ASF,Disable,"Disables ASF Alerts through on-board NIC.",,
00FD,"Built-in USB Controller",Off,"The BIOS disables the built-in USB controller at system startup.",,
00FE,"Built-in USB Controller","Enabled, Without Legacy Support","The BIOS enables the built-in USB controller, but does not provide legacy USB support for operating systems that do not natively support USB keyboards and mice.",,
00FF,"Built-in USB Controller","Enabled, With Legacy Support","The BIOS enables the built-in USB controller, and provides legacy USB support for operating systems that do not natively support USB keyboards and mice.",,
0100,"Reserved, do not assign",N/A,"Reserved, do not assign to future definitions.",,
0101,"Hard Disk Acoustic Mode",Bypass,"The BIOS does not modify the hard disks' currently set acoustic mode.",,
0102,"Hard Disk Acoustic Mode",Quiet,"The BIOS sets the hard disks' acoustic mode to the quietest operation.",,
0103,"Hard Disk Acoustic Mode",Suggested,"The BIOS sets the hard disks' acoustic mode to the manufacturer's suggested setting.",,
0104,"Hard Disk Acoustic Mode",Performance,"The BIOS sets the hard disks' acoustic mode for the highest disk performance.",,
0105,"Standby State",S1,"The system is placed into the ACPI S1 sleeping state when the system enters Standby.",,
0106,"Standby State",S3,"The system is placed into the ACPI S3 (save-to-RAM) sleeping state when the system enters Standby.",,
0107,"Interrupt 13h DMA",Enabled,"The BIOS enables interrupt 13h (disk, diskette) DMA on boot.",,
0108,"Interrupt 13h DMA",Disabled,"The BIOS disables interrupt 13h (disk, diskette) DMA on boot.",,
0109,"USB Emulation On, No USB Boot",Enabled,"Enables BIOS emulation of all supported USB devices except for bootable devices (floppy, USB flash, etc.). This is a security feature that will prevent users from inserting a USB boot device and booting an OS from it. Non-bootable devices (keyboard, mouse, hub) are still emulated.",,
010A,"Onboard Modem",Enable,"Enable onboard modem.",,
010B,"Onboard Modem",Disable,"Disable onboard modem.",,
010C,"Radio Transmission",Enable,"Enable radio transmission from MiniPCI Wireless or Bluetooth module.",,
010D,"Radio Transmission",Disable,"Disable radio transmission from MiniPCI Wireless or Bluetooth module.",,
010E,"Power Warning",Enable,"Enable messages about performance limitations based on power supply capacity.",,
010F,"Power Warning",Disable,"Disable messages about performance limitations based on power supply capacity.",,
0110,"Keypad On Numlock",Enable,"Activate internal keyboards’ embedded keypad when NumLock LED is on.",,
0111,"Keypad Only by Fn Key",Enable,"Activate internal keyboards’ embedded keypad when Fn Key is pressed.",,
0112,"Video Expansion",Enable,"Stretch lower resolutions modes to fill the LCD.",,
0113,"Video Expansion",Disable,"Preserve the LCD aspect ratio of the image and surround it with a large black border.",,
0114,"Wireless Device",Disable,"Wireless devices are always disabled.",,
0115,"Wireless Device Controlled by Application",Enable,"Wireless devices can be controlled by an application such as QuickSet",,
0116,"Wireless Device Controlled by Hotkey and Application",Enable,"Wireless devices can be controlled by the hotkey or by an application such as QuickSet.",,
0117,"Serial ATA Drive 0",OFF,"Sets the 1st Serial ATA drive controller to OFF.",,
0118,"Serial ATA Drive 0",AUTO,"Sets the 1st Serial ATA drive controller to Auto (enabled if present, POST error if not present).",,
0119,"Serial ATA Drive 1",OFF,"Sets the 2nd Serial ATA drive controller to OFF.",,
011A,"Serial ATA Drive 1",AUTO,"Sets the 2nd Serial ATA drive controller to Auto (enabled if present, POST error if not present).",,
011B,"Serial ATA Drive 2",OFF,"Sets the 3rd Serial ATA drive controller to OFF.",,
011C,"Serial ATA Drive 2",AUTO,"Sets the 3rd Serial ATA drive controller to Auto (enabled if present, POST error if not present).",,
011D,"Serial ATA Drive 3",OFF,"Sets the 4th Serial ATA drive controller to OFF.",,
011E,"Serial ATA Drive 3",AUTO,"Sets the 4th Serial ATA drive controller to Auto (enabled if present, POST error if not present).",,
011F,"Serial ATA Drive 4",OFF,"Sets the 5th Serial ATA drive cotroller to OFF.",,
0120,"Serial ATA Drive 4",AUTO,"Sets the 5th Serial ATA drive controller to Auto (enabled if present, POST error if not present).",,
0121,"Serial ATA Drive 5",OFF,"Sets the 6th Serial ATA drive controller to OFF.",,
0122,"Serial ATA Drive 5",AUTO,"Sets the 6th Serial ATA drive controller to Auto (enabled if present, POST error if not present).",,
0123,"Serial ATA Drive 6",OFF,"Sets the 7th Serial ATA drive controller to OFF.",,
0124,"Serial ATA Drive 6",AUTO,"Sets the 7th Serial ATA drive controller to Auto (enabled if present, POST error if not present).",,
0125,"Serial ATA Drive 7",OFF,"Sets the 8th Serial ATA drive controller to OFF.",,
0126,"Serial ATA Drive 7",AUTO,"Sets the 8th Serial ATA drive controller to Auto (enabled if present, POST error if not present).",,
0127,"Embedded NIC1","Enable with RPL Boot","Enable the system’s primary embedded network interface controller (full-function), including its RPL boot-ROM. Implementation note: See 3.7.2.12 Using the Network Interface Card Tokens on page 1 for more formation.",,
0128,"USB Flash Drive Emulation",Auto,"Specifies the BIOS emulation type for the USB flash drive. A USB flash drive is a portable USB mass storage device used for storage and transportation of data and applications. Currently Dell branded USB memory key is an example of an USB flash drive. If 'Auto' is selected, BIOS will auto-detect the current formatted media and decide the emulation type to use.",1.5h,
0129,"USB Flash Drive Emulation",Floppy,"If 'Floppy' is selected, BIOS will emulate the USB flash drive as a removable floppy media, and it will take drive letter A: or B:.",1.5h,
012A,"USB Flash Drive Emulation","Hard Disk","If 'Hard disk' is selected, BIOS will emulate the USB flash drive as a hard disk, and it will take drive letter C: or above.",1.5h,
012B,"SMART Errors",Enable,"Display HD SMART errors at POST.",1.5h,
012C,"SMART Errors",Disable,"Do NOT display HD SMART errors at POST.",1.5h,
012D,"Energy Star Logo",Enable,"Display Energy Star logo on DELL screen at POST.",1.5h,
012E,"Energy Star Logo",Disable,"Do NOT display Energy Star logo on DELL screen at POST.",1.5h,
012F,"Integrated Video Size",1MB,"Set the Default Integrated Video memory frame buffer size to 1MB (Stolen from main memory). This only applies when integrated video is being used.",1.5h,
0130,"Integrated Video Size",8MB,"Set the Default Integrated Video memory frame buffer size to 8MB (Stolen from main memory). This only applies when integrated video is being used.",1.5h,
0131,"Integrated Video Size",32MB,"Set the Default Integrated Video memory frame buffer size to 32MB (Stolen from main memory). This only applies when integrated video is being used.",1.5h,
0132,"On-board Serial ATA 2 Controller",Enable,"Enable on-board Serial ATA 2 controller.",1.5h,
0133,"On-board Serial ATA 2 Controller",Disable,"Disable on-board Serial ATA 2 controller.",1.5h,

0134,"Redundant Memory",RAID,"Redundant memory support is set for RAID memory feature. Any change takes effect on the next system boot. Note: The Attribute Name is generalized from “Redundant Memory Support” to “Redundant Memory” since DSIS v1.6. The Attribute Setting is also generalized from “RAID Enabled” to ‘RAID’ since DSIS v1.6.",1.5i,

0135,"SATA Controller",OFF,"Disable the SATA controller. The token applies to the first on-board SATA controller.",1.5i,

0136,"SATA Controller",Combined,"Enables the SATA controller to work in legacy mode with the IDE controller. Sets the device class code as IDE and uses IRQ 14 or 15. This token applies to the first on-board SATA controller.",1.5i,

0137,"SATA Controller",ATA,"Enables the SATA controller. Sets the device class code as IDE and uses PCI IRQ (referred as Native mode). This token applies to the first on-board SATA controller.",1.5i,

0138,"SATA Controller",AHCI,"Enables the SATA controller. Sets the device class code as SATA and sets up the AHCI BARs and registers. This token applies to the first on-board SATA controller.",1.5i,

0139,"SATA Controller",RAID,"Enables the SATA controller. Sets the device class code as RAID and executes the RAID Option ROM. This token applies to the first on-board SATA controller.",1.5i,

013A,"SATA Controller Shadow Copy",Combined,"The SATA controller is set to Combined mode on the previous system boot (from a BIOS perspective) or on the current system boot (from an application perspective). Notes: 1.This setting has no meaning unless the SATA controller is set to operate in Combined mode (see 0136h token). 2.The BIOS compares this value to the primary copy’s settings (see 0135h – 0139h) and prompts the user if a change is detected. 3.After handling the compare action, the BIOS copies the primary copy token value to the shadow copy token value on each boot. Manufacturing diagnostics and Toolkit use the Shadow Copy tokens to synchronize the controller settings to remove the unwanted BIOS prompts. This token applies to the first on-board SATA controller.",1.5i,

013B,"SATA Controller Shadow Copy",ATA,"The SATA controller is set to ATA mode on the previous system boot (from a BIOS perspective) or on the current system boot (from an application perspective). This token applies to the first on-board SATA controller. Notes: The notes for token “SATA Controller Shadow Copy - Combined” also apply to this token. This token applies to the first on-board SATA controller.",1.5i,

013C,"SATA Controller Shadow Copy",AHCI,"The SATA controller is set to AHCI mode on the previous system boot (from a BIOS perspective) or on the current system boot (from an application perspective). Notes: The notes for token “SATA Controller Shadow Copy - Combined” also apply to this token. This token applies to the first on-board SATA controller.",1.5i,

013D,"SATA Controller Shadow Copy",RAID,"The SATA controller is set to RAID mode on the previous system boot (from a BIOS perspective) or on the current system boot (from an application perspective). Notes: The notes for token “SATA Controller Shadow Copy - Combined” also apply to this token. This token applies to the first on-board SATA controller.",1.5i,

013E,"Memory Remapping",Off,"Memory remapping relocates memory space behind PCI hole to the space above 4G. With this feature enabled, OS can use the relocated memory as main memory.",1.5j,

013F,"Memory Remapping",Auto,"Memory remapping relocates memory space behind PCI hole to the space above 4G. With this feature disabled, memory space behind PCI hole is not relocated.",1.5j,

0140,"CPU XD Support",Off,"When Off, Intel CPUs that support the eXecute Disable (XD) feature will not report the support to the operating system.",1.5j,

0141,"CPU XD Support",Enabled,"When Enabled, Intel CPUs that support the eXecute Disable (XD) feature will report the support to the operating system. If the operating system supports this extended paging mechanism, it will provide some protection against software viruses that exploit buffer overflows.",1.5j,

0142,"Smartcard Reader",Off,"Disable built-in smartcard reader on the following boot.",1.5j,

0143,"Smartcard Reader",Enabled,"Enable built-in smartcard reader on the following boot.",1.5j,

0144,"TPM Enable",Off,"Hide the Trusted Platform Module (TPM) from the operating system on the following boot. There is no change in the TPM or its contents when it is disabled. Disabling the TPM simply causes it to be invisible to the OS until it is made visible again.",,

0145,"TPM Enable",Enabled,"Unhide Trusted Platform Module (TPM) from the operating system on the following boot.",1.5j,

0146,"USB Wake Support",Off,"Disable Wake On USB feature on the following boot.",1.5j,

0147,"USB Wake Support",Enabled,"Enabled Wake On USB feature on the following boot. Any USB input device can generate a wake event.",1.5j,

0148,"Demand-Based Power Management",Disabled,"This feature will allow the user to disable CPU P state tables reported to OS. The option is only available to the user if the CPU is capable of supporting this feature.",1.5j,

0149,"Demand-Based Power Management",Enabled,"This feature will allow the user to enable CPU P state tables reported to OS. The option is only available to the user if the CPU is capable of supporting this feature.",1.5j,

014A,"CPU Virtualization",Disabled,"This feature will allow the users to disable the VT technology in applicable CPUs. If disabled, the VT feature is unusable in any OS.",1.5k,

014B,"CPU Virtualization",Enabled,"This feature will allow the users to enable the VT technology in applicable CPUs.",1.5k,

014C,"Multiple CPU cores",Disable,"This feature will allow the users to disable Multiple CPU Cores if needed. If disabled, this would prevent the OS from seeing additional cores present on a single CPU package.",1.5k,

014D,"Multiple CPU cores",Enable,"This feature will allow the users to enable Multiple CPU Cores",1.5k,

014E,"Front USB Ports",Disabled,"This feature will allow the users to electrically enable or disable the Front USB ports. If disabled, they are unusable in any OS.",1.5k,

014F,"Front USB Ports",Enabled,"This feature will allow the users to electrically enable or disable the Front USB ports. If disabled, they are unusable in any OS.",1.5k,

0150,"Hot Undocking",Disabled,"This feature will allow the users to determine whether the notebook computer goes into the suspend state prior to undocking. When Hot Undocking is disabled, a request to undock the computer will result in the notebook transitioning to the S3 (suspend) state, where it can then be undocked.",1.5k,

0151,"Hot Undocking",Enabled,"This feature will allow the users to determine whether the notebook computer goes into the suspend state prior to undocking. When Hot Docking is enabled, the notebook will remain in the S0 state during a request to undock, and the operating system will display a message to the user when it is okay for the user to physically undock.",1.5k,

0152,"Bluetooth Devices",Enabled,"This feature will allow users to enable Bluetooth devices so that they will function within the operating system.",1.5k,
0153,"Bluetooth Devices",Disabled,"This feature will allow users to disable Bluetooth devices so that they will not function within the operating system.",1.5k,
0154,"SERR DMI Message",Off,"This token allows the user to disable the SERR on the DRAM controller and the PEG controller in the north bridge. This will disable the SERR DMI Messaging Mechanism.",1.5k,
0155,"SERR DMI Message",On,"This token allows the user to enable the SERR on the DRAM controller and the PEG controller in the north bridge. This will enable the SERR DMI Messaging Mechanism.",1.5k,
0156,"Intel Quick Resume Technology",Disabled,"Disable Energy Lake feature (Intel Quick Resume Technology)",2,
0157,"Intel Quick Resume Technology",Enabled,"Enable Energy Lake feature (Intel Quick Resume Technology)",2,
0158,"SATA 0 Raid",Off,"Disable SATA Drive 0 for on-board RAID enablement.",2,
0159,"SATA 0 Raid",On,"Enable SATA Drive 0 for on-board RAID enablement.",2,
015A,"SATA 1 Raid",Off,"Disable SATA Drive 1 for on-board RAID enablement.",2,
015B,"SATA 1 Raid",On,"Enable SATA Drive 1 for on-board RAID enablement.",2,
015C,"SATA 2 Raid",Off,"Disable SATA Drive 2 for on-board RAID enablement.",2,
015D,"SATA 2 Raid",On,"Enable SATA Drive 2 for on-board RAID enablement.",2,
015E,"SATA 3 Raid",Off,"Disable SATA Drive 3 for on-board RAID enablement.",2,
015F,"SATA 3 Raid",On,"Enable SATA Drive 3 for on-board RAID enablement.",2,
0160,"SATA 4 Raid",Off,"Disable SATA Drive 4 for on-board RAID enablement.",2,
0161,"SATA 4 Raid",On,"Enable SATA Drive 4 for on-board RAID enablement.",2,
0162,"SATA 5 Raid",Off,"Disable SATA Drive 5 for on-board RAID enablement.",2,
0163,"SATA 5 Raid",On,"Enable SATA Drive 5 for on-board RAID enablement.",2,
0164,"SATA 6 Raid",Off,"Disable SATA Drive 6 for on-board RAID enablement.",2,
0165,"SATA 6 Raid",On,"Enable SATA Drive 6 for on-board RAID enablement.",2,
0166,"SATA 7 Raid",Off,"Disable SATA Drive 7 for on-board RAID enablement.",2,
0167,"SATA 7 Raid",On,"Enable SATA Drive 7 for on-board RAID enablement.",2,
0168,"Limit CPUID Value",Off,"Some OS's (NT4) will fail if the value returned in EAX is > 3 when CPUID instruction is executed with EAX=0. This setting disables the 3 or less limit.",2,
0169,"Limit CPUID Value",On,"Some OS's (NT4) will fail if the value returned in EAX is > 3 when CPUID instruction is executed with EAX=0. This setting will limit CPUID function to 3.",2,
016A,"User Accessible USB Ports","All Ports Off","Disables both front and back user accessible USB ports.",2.001,
016B,"User Accessible USB Ports","Only Back Ports On","Disables the front user accessible USB ports.",2.001,
016C,"User Accessible USB Ports","All Ports On","Enables all user accessible USB ports.",2.001,
016D,"Integrated RAID Controller",Disabled,"Disables the integrated RAID controller.",2.001,
016E,"Integrated RAID Controller",Enabled,"Enables the integrated RAID controller.",2.001,
016F,"Integrated SAS Controller",Disabled,"Disables the integrated SAS controller.",2.001,
0170,"Integrated SAS Controller",Enabled,"Enables the integrated SAS controller.",2.001,
0171,"Adjacent Cache Line Prefetch",Disabled,"The CPU will only fetch the cache line that contains the data currently required by the CPU.",2.001,
0172,"Adjacent Cache Line Prefetch",Enabled,"Enables the CPU to fetch the adjacent cache line in the other half of the sector.",2.001,
0173,"Hardware Prefetcher",Disabled,"Disables the CPU’s HW prefetcher.",2.001,
0174,"Hardware Prefetcher",Enabled,"Enables the CPU’s HW prefetcher.",2.001,
0175,"Absolute Security ROM",Disabled,"This feature will allow users to permanently disable or permanently enable Absolute Software’s Computrace security software BIOS ROM. Once either token is written, the state is permanently maintained (i.e. this is a write-once field). This token is for Factory use only. Application and Management software must ignore or not use this token. Write-once-permanent is different from write-once. Write-once is reset on a power cycle and/or chipset reset. Write-once permanent cannot be reset/change once it is set.",2.001,
